{
  "$schema": "http://json-schema.org/draft-07/schema#",
  "title": "Portable agent-system profile",
  "type": "object",
  "additionalProperties": false,
  "required": [
    "$schema",
    "schemaVersion",
    "id",
    "authority",
    "reasoning",
    "advisor",
    "modelPolicies"
  ],
  "properties": {
    "$schema": {
      "const": "../../core/schemas/profile.schema.json"
    },
    "schemaVersion": {
      "const": 1
    },
    "id": {
      "enum": [
        "portable",
        "template"
      ]
    },
    "authority": {
      "enum": [
        "controlled",
        "full"
      ]
    },
    "reasoning": {
      "enum": [
        "surface-default",
        "maximum-supported"
      ]
    },
    "advisor": {
      "enum": [
        "disabled",
        "fable"
      ]
    },
    "modelPolicies": {
      "type": "object",
      "additionalProperties": false,
      "required": [
        "antigravity",
        "claude",
        "codex"
      ],
      "properties": {
        "antigravity": {
          "enum": [
            "surface-default",
            "approved-gemini-pro"
          ]
        },
        "claude": {
          "enum": [
            "surface-default",
            "approved-opus"
          ]
        },
        "codex": {
          "enum": [
            "surface-default",
            "approved-sol-terra"
          ]
        }
      }
    }
  }
}
