{
  "$schema": "../../core/schemas/profile.schema.json",
  "schemaVersion": 1,
  "id": "template",
  "authority": "full",
  "reasoning": "maximum-supported",
  "advisor": "fable",
  "modelPolicies": {
    "antigravity": "approved-gemini-pro",
    "claude": "approved-opus",
    "codex": "approved-sol-terra"
  }
}
